,Title,Published_date,Views,Likes,Comments,Month
0,State of Data Science - Web Data,2022-08-05,7706,312,29,Aug
1,Data Science Town Hall - State of Data Science,2022-08-04,8456,348,38,Aug
2,How I Would Learn to Code (If I Had to Start Over) | Data Track,2022-07-29,6798,426,48,Jul
3,5 Impactful Data Science Projects For Your Portfolio,2022-06-27,22855,1257,84,Jun
4,Can Machine Learning Fix My Baseball Swing?,2022-06-10,6283,307,68,Jun
5,Every Data Scientist... (funny!),2022-05-24,11829,701,141,May
6,State of Data Science (Town Hall) ft - Data Squad,2022-05-07,15515,426,65,May
7,Data Science Portfolio Project From Scratch | Building a YouTube Data Dashboard with Streamlit,2022-04-04,32273,975,81,Apr
8,Why You Are NOT Landing Data Jobs ... Yet,2022-03-25,14278,641,97,Mar
9,Can Data Defeat This Deceitful OpenSea NFT Scam?,2022-03-03,4353,183,51,Mar
10,When a PM Joins the Data Team... (funny!) - Ft @Luke Barousse,2022-02-21,9234,438,141,Feb
11,What Professional Data Scientists ACTUALLY Do,2022-02-14,76608,2664,174,Feb
12,Can You Analyze My Data Better Than I Can?,2022-01-31,6021,300,62,Jan
13,Giving Back to My Most Engaged Subscribers!,2022-01-28,2185,117,89,Jan
14,How to Make $1 Billion Betting on Horse Racing with Machine Learning,2022-01-24,10781,531,65,Jan
15,Should You Be Excited About Web 3? (As a Data Scientist),2022-01-17,7960,410,83,Jan
16,Should  @Luke Barousse Take This Data Analyst Job? (Funny) #Shorts,2022-01-14,6281,175,32,Jan
17,The Only Data Science Explanation You Need,2022-01-10,25805,1464,160,Jan
18,We Need to Talk About The LinkedIn Machine Learning Assessment.,2022-01-03,13576,630,142,Jan
19,How I Would Learn Data Science in 2022 (If I Had to Start Over),2021-12-27,264501,12051,466,Dec
20,What the Heck is WSL 2? (My New Favorite Tool),2021-12-17,7350,315,57,Dec
21,How Statistics Saved the US SERIOUS $$$$ During WW2 #Shorts,2021-12-10,5873,398,21,Dec
22,How Zillow Lost $500 MILLION With Machine Learning,2021-12-03,21512,1066,151,Dec
23,Why Is Data Engineering So HOT Right Now?,2021-11-26,26539,1005,136,Nov
24,Is Data Science Dying?,2021-11-19,99338,3235,331,Nov
25,7 Incredible Books That Transformed My Health and My Life,2021-11-12,7403,376,112,Nov
26,Why EVERYONE Should Start a Podcast (Including YOU),2021-11-05,3514,196,48,Nov
27,Building a Burrito Dashboard - Data Science Project from Scratch with atoti,2021-10-29,8667,241,31,Oct
28,ML Ops: What is it REALLY?,2021-10-22,4863,229,61,Oct
29,Business Skills for Data Science: What are they REALLY?,2021-10-18,6149,283,50,Oct
30,#66DaysOfData Round 3 Live Event! (feat. @StatQuest with Josh Starmer),2021-10-12,2171,123,5,Oct
31,Roasting My First Data Science Project (Common Project Mistakes),2021-10-08,5256,267,67,Oct
32,Is Data Visualization Important for Data Science? (A Data Scientist's Perspective),2021-08-20,11601,508,112,Aug
33,Project Presentation - Expectations vs. Reality (funny) #shorts,2021-08-07,7613,288,32,Aug
34,Data Science Project - Expectations vs Reality (funny) #shorts,2021-08-06,28005,1026,29,Aug
35,How I Learned to Learn.,2021-07-31,39235,1970,196,Jul
36,Is Spotify Shuffle Really Random? #Shorts,2021-07-21,8103,464,49,Jul
37,I Eat a Papaya Live on Stream (Plus Q&A for 150K Subs!),2021-07-16,2346,93,30,Jul
38,Why are APIs Important for Data Science?,2021-07-09,8098,404,92,Jul
39,Is Your Phone REALLY Listening to You?,2021-07-03,4833,274,118,Jul
40,Kaggle vs Github - Which is Best for Your Data Science Portfolio?,2021-06-25,11147,496,121,Jun
41,#66DaysOfData - 3 Reasons to Start!,2021-06-18,3721,196,38,Jun
42,#66DaysOfData - What is it? #shorts,2021-06-11,7569,331,53,Jun
43,A Quick Data Science Project Tip! #SHORTS,2021-06-03,14015,789,89,Jun
44,Discouraged with Data Science? - Watch THIS video.,2021-05-28,7186,383,199,May
45,How Data Science Projects Pay Off,2021-05-22,9906,575,146,May
46,How I Use Data to Optimize My Life | What I Collect & How I Analyze It,2021-05-14,9923,464,136,May
47,What is a lambda function (python)? #shorts,2021-05-13,10272,661,47,May
48,Why Kaggle Should Be Your Favorite Data Science Resource #shorts,2021-05-07,17404,789,57,May
49,What is Pandas? (Data & Data Science) #shorts,2021-04-30,16571,721,88,Apr
50,The 7 Biggest Data Science  Beginner Mistakes,2021-04-23,64471,2939,278,Apr
51,Data Scientist Reacts: REAL Data Science Job Application Data,2021-04-16,22078,647,90,Apr
52,Why You Probably Won't Become a Data Scientist,2021-04-09,122942,3590,475,Apr
53,How to Go From Data Analyst to Data Scientist,2021-04-02,46995,1337,174,Apr
54,Why I Have 2 Offices for Data Science & Content Creation,2021-03-26,3777,137,89,Mar
55,MARCH MADNESS - Will My Machine Learning Model Beat Your Bracket?,2021-03-19,13926,307,106,Mar
56,My Regrets as a Data Science Student,2021-03-12,22230,818,112,Mar
57,My Daily Battle With Time - Will I Win? [Vlog],2021-03-08,3733,194,83,Mar
58,What is the Future of my Comment Leaderboard Project?,2021-02-26,5397,198,81,Feb
59,How to Build a Website  - Building my ULTIMATE Portfolio Website,2021-02-19,5959,162,51,Feb
60,Why I Quit Data Science,2021-02-12,102263,2306,347,Feb
61,🌶 Hot Topics in Tech: Data Science Explained #SHORTS,2021-01-29,8887,411,115,Jan
62,How I Balance Data Science and Content Creation (7 Secrets),2021-01-23,6872,293,126,Jan
63,Kaggle Project From Scratch - Part 3 (Advanced Graphs & Gender Imbalance Analysis),2021-01-16,8168,270,52,Jan
64,Kaggle Project From Scratch - Part 2 (Exploratory Data Analysis),2021-01-08,18361,632,134,Jan
65,Kaggle Project From Scratch - Part 1 (Data Science Profession Survey),2021-01-02,30750,1035,147,Jan
66,What is the #66DaysOfData?,2020-12-26,63551,2154,208,Dec
67,How I Would Learn Data Science in 2021 (What Has Changed?),2020-12-19,128836,5923,505,Dec
68,Unboxing the Ultimate Z by HP Data Science Package (FIRST EVER HP Workstation w/ Data Science Stack),2020-12-10,10093,379,136,Dec
69,I Built the FIRST EVER YouTube Subscriber LEADERBOARD,2020-12-07,22295,703,325,Dec
70,7 Things to Look For in a Masters For Data Science (feat. @Tina Huang),2020-11-20,23278,738,163,Nov
71,6 Lessons from #66DaysOfData,2020-11-13,6548,339,95,Nov
72,100K Channel Update + AMA Stream!,2020-11-12,2313,128,24,Nov
73,Find a Data Science Project With These 3 Techniques,2020-11-06,14855,635,101,Nov
74,How I Chose My Masters Degree for Breaking into Data Science,2020-10-30,22261,601,154,Oct
75,git for Data Science Made Simple... (Hopefully),2020-10-23,15509,747,92,Oct
76,The PODCAST you might have asked for?,2020-10-19,1980,94,44,Oct
77,Dealing with Doubt in Data Science (My Impostor Syndrome Story),2020-10-16,6474,444,113,Oct
78,Advice from a Data Analytics CEO (@How to Get an Analytics Job) - KNN EP. 17,2020-10-14,11628,357,48,Oct
79,Data Science Resume Round-Up With @Tina Huang  | Episode 3,2020-10-12,5796,127,62,Oct
80,5 Unusual Data Science Projects that Will Land You a Job,2020-10-09,8733,484,81,Oct
81,Sh*t Data Scientists Say (Parody),2020-10-05,9009,570,142,Oct
82,5 Proven Strategies to Break into a Data Science Job,2020-10-02,8387,362,93,Oct
83,Why Data-Viz is so Darn Important (@Story by Data | Kate Strachnyi) - KNN EP. 16,2020-09-30,6872,283,61,Sep
84,Data Science Resume Round-Up With @Tina Huang  - Episode 1,2020-09-28,10343,274,69,Sep
85,5 Essential Data Science Projects for Your Portfolio,2020-09-26,64501,2880,201,Sep
86,His Startup Will Land You a Data Science Job (Jeremie Harris) - KNN EP. 15,2020-09-23,4963,191,66,Sep
87,Reviewing Your Data Science Projects - Episode 21(The Cleanest Portfolio),2020-09-21,9615,395,58,Sep
88,"Hedge Funds, Startups, and Data Science Oh my! (@DataLeap) - KNN EP. 14",2020-09-18,7126,249,34,Sep
89,Land a Data Science Job in a Different Country (Vijay Pravin Maharajan) - KNN EP. 13,2020-09-16,4999,192,56,Sep
90,Reviewing Your Data Science Projects - Episode 20 (Bootcamp Capstone),2020-09-14,3912,152,35,Sep
91,The 5 Pillars of Success I Live By,2020-09-11,9937,868,153,Sep
92,Fast Cars to Faster Data (Alex Castrounis) - KNN EP. 12,2020-09-09,1862,77,25,Sep
93,Reviewing Your Data Science Projects - Episode 19 (One Big Improvement),2020-09-07,3806,158,43,Sep
94,How I Learn Data Science Through Studying Other People's Code | #66DaysOfData,2020-09-04,11156,715,143,Sep
95,How She Dominated the FAANG Data Science Interview  (@Tina Huang ) - KNN EP. 11,2020-09-02,17235,557,90,Sep
96,Reviewing Your Data Science Projects - Episode 18 (Job-Worthy GitHub),2020-08-31,15997,753,93,Aug
97,Why I'm Starting Data Science Over Again.,2020-08-29,50250,2599,452,Aug
98,Inside the Mind of the Ultimate Kaggle Grandmaster (@Abhishek Thakur ) - KNN EP. 10,2020-08-26,14161,591,76,Aug
99,Reviewing Your Data Science Projects - Episode 17 (Best Portfolio Website Yet?),2020-08-24,11473,428,54,Aug
100,Don't Buy My Course..,2020-08-21,7266,356,148,Aug
101,How a Subscriber Landed a Data Analyst Job in Less Than a Year (Ray Ojel) - KNN EP. 09,2020-08-19,27539,1071,166,Aug
102,Reviewing Your Projects - Episode 16 (Project Review for Beginners),2020-08-17,3109,128,40,Aug
103,Data Scientist Dismantles the YouTube Algorithm.,2020-08-14,6036,533,110,Aug
104,Sports Analytics & Streaming Data Science on Twitch (Nick Wan) - KNN EP. 08,2020-08-12,4698,182,39,Aug
105,Reviewing Your Data Science Projects - Episode 15 (Quant Finance),2020-08-10,9393,308,53,Aug
106,The Plagiarism Problem in Data Science,2020-08-07,12881,624,150,Aug
107,Interview with the Director of AI Research @ NVIDIA (Anima Anandkumar) - KNN EP. 07,2020-08-05,13929,591,88,Aug
108,Reviewing Your Data Science Projects - Episode 14 [Deep Learning Focus],2020-08-03,4658,183,56,Aug
109,My First Data Science Contracting Side-Gig (How I Did It),2020-07-31,10187,546,90,Jul
110,Do You Have a Data Science Mentor? (@Danny Ma) - KNN EP. 06,2020-07-30,2265,115,34,Jul
111,Reviewing Your Data Science Projects - Episode 13 (BONUS LinkedIn Review),2020-07-27,5349,249,112,Jul
112,Building a Deep Learning BEAST (NVIDIA TITAN RTX + RYZEN 3900X),2020-07-24,8035,246,201,Jul
113,Is it Important to Share Your Data Science Work? (Ft. Eric Weber),2020-07-22,1825,98,27,Jul
114,Reviewing Your Data Science Resumes - Episode 12 (3 Different Resumes!),2020-07-20,25914,532,90,Jul
115,Beginner Kaggle Data Science Project Walk-Through (Titanic),2020-07-17,231547,5582,388,Jul
116,Uber Driver to Machine Learning Engineer in 9 Months! (@Daniel Bourke) - KNN EP. 05,2020-07-16,28309,1065,120,Jul
117,Reviewing Your Data Science Projects - Episode 11(GITHUB CLEANING),2020-07-13,3470,132,50,Jul
118,The Best Computer for Data Science Beginners,2020-07-10,32732,786,156,Jul
119,Should You Major in Data Science? (Jaemin Lee) - KNN EP. 04,2020-07-08,5987,227,84,Jul
120,Critiquing MY OWN Data Science Resume,2020-07-06,11965,385,92,Jul
121,Where to Start Learning Data Science,2020-07-03,17781,750,131,Jul
122,"Data Science Productivity, Motivation, and Organization (ft. Data Professor & Codebasics)",2020-07-01,3867,195,37,Jul
123,Reviewing Your Data Science Projects - Episode 10 (Leveraging Your Data),2020-06-29,4400,174,54,Jun
124,How to Get a Data Science Job at FAANG (@Data Science Jay) - KNN EP. 03,2020-06-26,14566,522,79,Jun
125,Reviewing Your Data Science Projects - Episode 9 (Professional Violinist),2020-06-22,2309,81,40,Jun
126,"Ken Jee Q & A Live Stream (50,000 Sub Special!)",2020-06-20,2358,137,51,Jun
127,Reviewing Your Data Science Projects - Episode 8 (College Student Help),2020-06-15,4147,163,46,Jun
128,Why You're Struggling to Learn Data Science,2020-06-12,14894,999,159,Jun
129,Reviewing Your Data Science Projects - Episode 7 (Incredible Portfolio Website),2020-06-08,9862,309,70,Jun
130,The State of Data Science with Krish Naik & The Data Professor [Panel Discussion],2020-06-05,21028,643,151,Jun
131,Reviewing Your Data Science Projects - Episode 6 (Only 3 months of coding experience),2020-06-01,5599,154,53,Jun
132,How to Build a Data Science Portfolio Website with Hugo & Github Pages [feat. Data Professor],2020-05-29,56507,1871,263,May
133,Reviewing Your Data Science Projects - Episode 5 (Very Detailed Project),2020-05-25,20806,487,81,May
134,Different Data Science Roles Explained (by a Data Scientist),2020-05-22,49221,1745,175,May
135,Reviewing Your Data Science Projects - Episode 4 (Resume & Github),2020-05-18,11015,174,55,May
136,How to Make A Data Science Portfolio Website with Github Pages,2020-05-15,93580,3487,185,May
137,10000 Subscriber and 100th Video Special (Data Science),2020-05-13,3082,146,115,May
138,Reviewing Your Data Science Projects - Episode 3 (Student Portfolio),2020-05-11,4260,149,74,May
139,How I Would Learn Data Science (If I Had to Start Over),2020-05-08,1351514,48019,1986,May
140,Reviewing Your Data Science Projects - Episode 2 (Resume and Portfolio),2020-05-04,5039,185,42,May
141,What You Need to Know for a Data Science Internship,2020-05-01,16597,974,59,May
142,Reviewing Your Data Science Projects - Episode 1 (Exploratory Analysis),2020-04-27,7913,341,57,Apr
143,What It's Like to be a Socially Distanced Data Scientist (A Day in the Life),2020-04-24,14791,459,103,Apr
144,Data Science in Sports - Talk for Northwestern (Kellogg) MBA Students,2020-04-22,2949,84,24,Apr
145,5 Tips for Crushing the Work From Home Life,2020-04-20,5186,199,38,Apr
146,Data Science Project from Scratch - Part 7 (Documenting Your Work),2020-04-17,15092,609,121,Apr
147,Data Science Project from Scratch -  Part 6 (Putting the Model into Production),2020-04-15,21791,611,95,Apr
148,Data Science Project from Scratch  - Part 5 (Model Building),2020-04-13,33335,727,140,Apr
149,Data Science Project from Scratch - Part 4 (Exploratory Data Analysis),2020-04-10,57074,1608,205,Apr
150,Data Science Project from Scratch - Part 3 (Data Cleaning),2020-04-08,60256,1474,259,Apr
151,Data Science Project from Scratch - Part 2 (Data Collection),2020-04-06,87444,2719,614,Apr
152,Data Science Project from Scratch - Part 1 (Project Planning),2020-04-03,127862,3716,161,Apr
153,When Data Science Goes Wrong,2020-03-30,1752,106,32,Mar
154,How to ULTRALEARN Data Science,2020-03-27,59251,3713,168,Mar
155,Why Right NOW is a Great Time to Learn Data Science,2020-03-23,4210,265,50,Mar
156,Data Science Project Example Start to Finish (Deep Learning Image Classifier),2020-03-20,11449,429,44,Mar
157,The Secret Data Scientists Don't Want You to Know,2020-03-16,10151,1102,107,Mar
158,The 5 Stages of Learning Data Science,2020-03-13,16578,1251,78,Mar
159,Can You Learn Data Science Without a Computer?,2020-03-11,1293,97,14,Mar
160,The Best Free Data Science Courses Nobody is Talking About,2020-03-09,324689,20303,612,Mar
161,The Data Science Projects that Got Me a Job,2020-03-06,37330,1313,41,Mar
162,How to Integrate Data Science into Your Business,2020-03-02,2997,118,18,Mar
163,The Problem with Data Science,2020-02-28,3575,149,21,Feb
164,How Much Did Cheating Help the Astros Win? (What the Numbers Say),2020-02-24,1059,45,16,Feb
165,How to Set Up Your Data Science Environment (Anaconda Beginner),2020-02-21,95705,1970,89,Feb
166,3 Proven Data Science Projects for Beginners (Kaggle),2020-02-17,286963,16363,507,Feb
167,Data Science Advice for College Students,2020-02-14,66710,1911,195,Feb
168,Avoid These Data Science Resume Mistakes!,2020-02-10,25482,1142,57,Feb
169,Data Science Explained with ... Cooking?,2020-02-07,4464,278,45,Feb
170,The 4 Types of Sports Analytics Projects,2020-02-03,22674,787,59,Feb
171,Data Science in Golf: PGA Merchandise Show 2020,2020-01-31,530,18,13,Jan
172,How I Learned Data Science,2020-01-27,90665,2591,210,Jan
173,What is Sports Analytics Really?,2020-01-20,16740,501,73,Jan
174,Data Science Certificate vs Bootcamp vs Masters Degree,2020-01-18,102471,2904,577,Jan
175,How To Learn Programming for Data Science [3 Steps],2020-01-13,28273,1908,96,Jan
176,Data Science Fundamentals: SQL Queries,2020-01-10,5567,198,32,Jan
177,Questions You Should Ask Your Data Science Interviewers,2020-01-06,2667,136,14,Jan
178,The 9 Books That Changed My Perspective in 2019,2020-01-03,3207,178,23,Jan
179,The Data Science Interview: What to Expect,2019-12-30,7380,348,32,Dec
180,5 Data Science Resolutions for 2020,2019-12-27,468,25,12,Dec
181,How to Scrape NBA Data Using the nba_api Python Module,2019-12-23,13634,490,91,Dec
182,Collision Course: Sports Betting + Data Science,2019-12-20,12993,404,26,Dec
183,3 Reasons You Should NOT Become a Data Scientist,2019-12-16,98431,2879,214,Dec
184,5 Sports Analytics Books to Get You Started,2019-12-13,8789,328,55,Dec
185,Math Needed for Mastering Data Science,2019-12-09,52867,2722,225,Dec
186,The 5 Stages of Data Science Adoption,2019-12-06,1174,64,17,Dec
187,How YOU Can Land a Sports Analytics Job,2019-12-02,58992,2669,222,Dec
188,Data Science Fundamentals: Linear Regression,2019-11-29,5541,158,41,Nov
189,Golf: Would You Rather Be the LONGEST or STRAIGHTEST Driver on the PGA Tour?,2019-11-25,896,45,12,Nov
190,Sports Analytics 101: The Pythagorean Theorem of Sports,2019-11-22,5069,239,26,Nov
191,9 Ways You Can Make Extra Income as a Data Scientist,2019-11-18,43447,1672,80,Nov
192,Applying Data Science To My YouTube Data: My Surprising Findings,2019-11-11,5793,136,31,Nov
193,Why Selling Is An Important Data Science Skill,2019-11-04,1530,74,13,Nov
194,By The Numbers: Where Should The NBA Put a 4 Point Line?,2019-10-21,2548,69,18,Oct
195,Why is Balance Important in Data Science?,2019-10-16,661,32,13,Oct
196,How to Stay Productive & Motivated When Learning Data Science,2019-09-29,10889,547,56,Sep
197,How Far Should the NBA 3-Point Line Actually Be?,2019-09-21,3003,99,29,Sep
198,6 Habits of Successful Data Scientists,2019-09-13,1838,87,17,Sep
199,How To Build A Word Cloud From Scraped Data (Python),2019-09-04,3383,85,9,Sep
200,Thank You For The Support | What's Next | Ken Jee | Data Science,2019-08-26,512,24,29,Aug
201,Is Data Science Right For You?,2019-08-18,47244,1107,109,Aug
202,Data Science Fundamentals: Data Cleaning in Python,2019-08-11,12921,356,53,Aug
203,How To Get Data Science Experience (Without a Job),2019-08-08,27526,1313,71,Aug
204,Take Your Data Science Projects From Good to Great,2019-08-05,1517,104,11,Aug
205,The Projects You Should Do To Get A Data Science Job,2019-07-30,141253,5471,249,Jul
206,What Does a Data Scientist Actually Do?,2019-07-19,31750,1082,74,Jul
207,Data Science Fundamentals: Data Manipulation in Python (Pandas),2019-07-13,11221,324,41,Jul
208,Data Science Fundamentals: Data Exploration in Python (Pandas),2019-07-05,15755,482,61,Jul
209,Data Science: Pros and Cons,2019-06-30,4638,200,18,Jun
210,How I Got My First Data Science Internship (And How You Can Land One),2019-06-21,22175,1082,89,Jun
211,My Top 5 Data Science Internship Tips,2019-06-15,10327,443,19,Jun
212,Golf STATS: Strokes Gained Explained,2019-06-07,5926,127,28,Jun
213,Most Data Science Hopefuls Overlook This Important Skill,2019-05-25,579,44,5,May
214,What I Learned From My Three Degrees,2019-05-17,1175,58,12,May
215,I Wish I Had Known THIS Before Starting in Data Science,2019-05-14,24899,1043,67,May
216,NASA Physicist Turned Data Scientist (Tim Bowling) - KNN EP. 02,2019-05-05,1159,40,2,May
217,Should You Learn R for Data Science?,2019-04-25,17873,498,69,Apr
218,Scrape Twitter Data in Python with Twitterscraper Module,2019-04-18,44591,824,337,Apr
219,Work From Home Data Scientist: Day in the Life,2019-04-12,27619,751,103,Apr
220,Where to Look for Data Science Jobs,2019-03-29,2906,118,9,Mar
221,Data Science: Startup vs. Large Corporation,2019-03-21,1905,71,4,Mar
222,"Data Science, Machine Learning, and AI: What's the Difference?",2019-03-16,5506,155,25,Mar
223,Was Captain Marvel Bad? A Sentiment Analysis of Twitter Data,2019-03-09,3936,171,14,Mar
224,Why You DON'T Want to be a WFH Data Scientist,2019-03-03,738,29,12,Mar
225,Welcome To My Channel | Ken Jee | Data Science,2019-03-03,1315,33,8,Mar
226,Where YOU Should Start With Data Science Projects,2019-02-19,12723,277,17,Feb
227,Watch This Before Applying to Data Science Jobs,2019-02-04,1402,62,13,Feb
228,My Top 5 Data Science Resources for 2019,2019-01-05,3584,117,17,Jan
229,IT'S NOT TOO LATE TO LEARN CODE!,2018-12-18,790,36,6,Dec
230,The Best Way to Predict NBA Minutes Played,2018-12-11,3536,95,13,Dec
231,Demystifying Data Science Roles,2018-11-30,1080,51,5,Nov
232,How to Simulate NBA Games in Python,2018-11-19,15545,353,54,Nov
233,Should You Get A Masters in Data Science?,2018-11-14,19759,294,141,Nov
234,How I Became A Data Scientist From a Business Background,2018-11-12,6062,187,23,Nov
235,Predicting Season Long NBA Wins Using Multiple Linear Regression,2018-07-10,7766,176,17,Jul
236,Predicting Crypto-Currency Price Using RNN lSTM & GRU,2017-11-18,17824,270,41,Nov
